{
  "image_sha256": "23ef930b5cc30c8100fe637c3e8136959da8b3b3a75488539d773b8ba2d1efcd",
  "width": 1080,
  "height": 2400,
  "engine": "synthetic",
  "recorded_at": "2026-10-28T00:00:00Z",
  "tokens": [
    {
      "text": "10:24",
      "box": [
        48,
        35,
        129,
        58
      ],
      "line": 1,
      "block": 1
    },
    {
      "text": "5G",
      "box": [
        926,
        39,
        962,
        60
      ],
      "line": 2,
      "block": 1
    },
    {
      "text": "DEMO",
      "box": [
        340,
        105,
        437,
        128
      ],
      "line": 3,
      "block": 2
    },
    {
      "text": "·",
      "box": [
        445,
        114,
        454,
        128
      ],
      "line": 3,
      "block": 2
    },
    {
      "text": "fictional",
      "box": [
        462,
        103,
        594,
        128
      ],
      "line": 3,
      "block": 2
    },
    {
      "text": "provider",
      "box": [
        602,
        103,
        739,
        136
      ],
      "line": 3,
      "block": 2
    },
    {
      "text": "K",
      "box": [
        77,
        192,
        107,
        224
      ],
      "line": 4,
      "block": 3
    },
    {
      "text": "Kestrel",
      "box": [
        152,
        190,
        307,
        224
      ],
      "line": 5,
      "block": 4
    },
    {
      "text": "Go",
      "box": [
        318,
        191,
        377,
        224
      ],
      "line": 5,
      "block": 4
    },
    {
      "text": "Choose",
      "box": [
        60,
        923,
        235,
        960
      ],
      "line": 6,
      "block": 5
    },
    {
      "text": "a",
      "box": [
        247,
        933,
        276,
        960
      ],
      "line": 6,
      "block": 5
    },
    {
      "text": "ride",
      "box": [
        288,
        923,
        383,
        960
      ],
      "line": 6,
      "block": 5
    },
    {
      "text": "Riverside",
      "box": [
        60,
        991,
        196,
        1016
      ],
      "line": 7,
      "block": 6
    },
    {
      "text": "Gate",
      "box": [
        204,
        992,
        275,
        1016
      ],
      "line": 7,
      "block": 6
    },
    {
      "text": "to",
      "box": [
        283,
        994,
        314,
        1016
      ],
      "line": 7,
      "block": 6
    },
    {
      "text": "Airport",
      "box": [
        322,
        991,
        427,
        1024
      ],
      "line": 7,
      "block": 6
    },
    {
      "text": "Terminal",
      "box": [
        435,
        991,
        568,
        1016
      ],
      "line": 7,
      "block": 6
    },
    {
      "text": "Z112",
      "box": [
        888,
        1108,
        1008,
        1146
      ],
      "line": 8,
      "block": 7
    },
    {
      "text": "Z135",
      "box": [
        932,
        1175,
        1008,
        1201
      ],
      "line": 9,
      "block": 7
    },
    {
      "text": "Bike",
      "box": [
        184,
        1108,
        280,
        1142
      ],
      "line": 10,
      "block": 7
    },
    {
      "text": "2",
      "box": [
        184,
        1174,
        202,
        1198
      ],
      "line": 11,
      "block": 7
    },
    {
      "text": "min",
      "box": [
        210,
        1173,
        268,
        1198
      ],
      "line": 11,
      "block": 7
    },
    {
      "text": "·",
      "box": [
        276,
        1184,
        285,
        1198
      ],
      "line": 11,
      "block": 7
    },
    {
      "text": "Beat",
      "box": [
        293,
        1174,
        362,
        1198
      ],
      "line": 11,
      "block": 7
    },
    {
      "text": "the",
      "box": [
        370,
        1173,
        420,
        1198
      ],
      "line": 11,
      "block": 7
    },
    {
      "text": "traffic",
      "box": [
        428,
        1172,
        516,
        1198
      ],
      "line": 11,
      "block": 7
    },
    {
      "text": "Z180–210",
      "box": [
        772,
        1298,
        1008,
        1337
      ],
      "line": 12,
      "block": 8
    },
    {
      "text": "Auto",
      "box": [
        184,
        1300,
        289,
        1332
      ],
      "line": 13,
      "block": 8
    },
    {
      "text": "4",
      "box": [
        184,
        1364,
        202,
        1388
      ],
      "line": 14,
      "block": 8
    },
    {
      "text": "min",
      "box": [
        210,
        1363,
        268,
        1388
      ],
      "line": 14,
      "block": 8
    },
    {
      "text": "·",
      "box": [
        276,
        1374,
        285,
        1388
      ],
      "line": 14,
      "block": 8
    },
    {
      "text": "No",
      "box": [
        293,
        1364,
        336,
        1388
      ],
      "line": 14,
      "block": 8
    },
    {
      "text": "bargaining",
      "box": [
        344,
        1363,
        509,
        1396
      ],
      "line": 14,
      "block": 8
    },
    {
      "text": "Z289",
      "box": [
        888,
        1488,
        1008,
        1527
      ],
      "line": 15,
      "block": 9
    },
    {
      "text": "Kestrel",
      "box": [
        184,
        1488,
        339,
        1522
      ],
      "line": 16,
      "block": 9
    },
    {
      "text": "Mini",
      "box": [
        350,
        1488,
        446,
        1522
      ],
      "line": 16,
      "block": 9
    },
    {
      "text": "6",
      "box": [
        184,
        1554,
        202,
        1578
      ],
      "line": 17,
      "block": 9
    },
    {
      "text": "min",
      "box": [
        210,
        1553,
        268,
        1578
      ],
      "line": 17,
      "block": 9
    },
    {
      "text": "·",
      "box": [
        276,
        1564,
        285,
        1578
      ],
      "line": 17,
      "block": 9
    },
    {
      "text": "Compact",
      "box": [
        293,
        1554,
        427,
        1586
      ],
      "line": 17,
      "block": 9
    },
    {
      "text": "AC",
      "box": [
        435,
        1554,
        475,
        1578
      ],
      "line": 17,
      "block": 9
    },
    {
      "text": "cars",
      "box": [
        483,
        1560,
        544,
        1578
      ],
      "line": 17,
      "block": 9
    },
    {
      "text": "Pay",
      "box": [
        60,
        2172,
        114,
        2204
      ],
      "line": 18,
      "block": 10
    },
    {
      "text": "by",
      "box": [
        121,
        2171,
        158,
        2204
      ],
      "line": 18,
      "block": 10
    },
    {
      "text": "cash",
      "box": [
        165,
        2171,
        233,
        2196
      ],
      "line": 18,
      "block": 10
    },
    {
      "text": "or",
      "box": [
        241,
        2178,
        273,
        2196
      ],
      "line": 18,
      "block": 10
    },
    {
      "text": "UPI",
      "box": [
        281,
        2172,
        334,
        2196
      ],
      "line": 18,
      "block": 10
    },
    {
      "text": "Book",
      "box": [
        432,
        2272,
        544,
        2306
      ],
      "line": 19,
      "block": 11
    },
    {
      "text": "now",
      "box": [
        554,
        2281,
        648,
        2306
      ],
      "line": 19,
      "block": 11
    }
  ],
  "variant": "rupee_as_Z",
  "expect": {
    "rows": [
      "VERIFIED",
      "VERIFIED",
      "VERIFIED"
    ],
    "reason": "₹ read as 'Z'; the parser normalises it (M5)"
  }
}
