{
  "image_sha256": "e51eaf82d40c9fd6b6554505b54ecf0950a5d515254538dc21347dec6f16b963",
  "width": 1080,
  "height": 2400,
  "engine": "synthetic",
  "recorded_at": "2026-10-28T00:00:00Z",
  "tokens": [
    {
      "text": "10:24",
      "box": [
        48,
        35,
        129,
        58
      ],
      "line": 1,
      "block": 1
    },
    {
      "text": "5G",
      "box": [
        926,
        39,
        962,
        60
      ],
      "line": 2,
      "block": 1
    },
    {
      "text": "DEMO",
      "box": [
        340,
        105,
        437,
        128
      ],
      "line": 3,
      "block": 2
    },
    {
      "text": "·",
      "box": [
        445,
        114,
        454,
        128
      ],
      "line": 3,
      "block": 2
    },
    {
      "text": "fictional",
      "box": [
        462,
        103,
        594,
        128
      ],
      "line": 3,
      "block": 2
    },
    {
      "text": "provider",
      "box": [
        602,
        103,
        739,
        136
      ],
      "line": 3,
      "block": 2
    },
    {
      "text": "P",
      "box": [
        78,
        192,
        106,
        224
      ],
      "line": 4,
      "block": 3
    },
    {
      "text": "Pepper",
      "box": [
        152,
        192,
        308,
        235
      ],
      "line": 5,
      "block": 4
    },
    {
      "text": "Rides",
      "box": [
        319,
        190,
        437,
        224
      ],
      "line": 5,
      "block": 4
    },
    {
      "text": "Driver",
      "box": [
        60,
        1183,
        210,
        1220
      ],
      "line": 6,
      "block": 5
    },
    {
      "text": "assigned",
      "box": [
        222,
        1183,
        434,
        1232
      ],
      "line": 6,
      "block": 5
    },
    {
      "text": "9",
      "box": [
        60,
        1267,
        94,
        1311
      ],
      "line": 7,
      "block": 6
    },
    {
      "text": "min",
      "box": [
        110,
        1265,
        226,
        1310
      ],
      "line": 7,
      "block": 6
    },
    {
      "text": "away",
      "box": [
        242,
        1277,
        400,
        1324
      ],
      "line": 7,
      "block": 6
    },
    {
      "text": "2.8",
      "box": [
        60,
        1346,
        112,
        1372
      ],
      "line": 8,
      "block": 7
    },
    {
      "text": "km",
      "box": [
        121,
        1345,
        174,
        1372
      ],
      "line": 8,
      "block": 7
    },
    {
      "text": "from",
      "box": [
        183,
        1344,
        266,
        1372
      ],
      "line": 8,
      "block": 7
    },
    {
      "text": "pickup",
      "box": [
        275,
        1345,
        386,
        1381
      ],
      "line": 8,
      "block": 7
    },
    {
      "text": "R",
      "box": [
        100,
        1473,
        132,
        1508
      ],
      "line": 9,
      "block": 8
    },
    {
      "text": "Ravi",
      "box": [
        196,
        1444,
        290,
        1478
      ],
      "line": 10,
      "block": 9
    },
    {
      "text": "Auto",
      "box": [
        196,
        1504,
        267,
        1528
      ],
      "line": 11,
      "block": 10
    },
    {
      "text": "·",
      "box": [
        275,
        1514,
        284,
        1528
      ],
      "line": 11,
      "block": 10
    },
    {
      "text": "Demo",
      "box": [
        292,
        1504,
        382,
        1528
      ],
      "line": 11,
      "block": 10
    },
    {
      "text": "Motors",
      "box": [
        390,
        1504,
        497,
        1528
      ],
      "line": 11,
      "block": 10
    },
    {
      "text": "XX",
      "box": [
        712,
        1477,
        763,
        1504
      ],
      "line": 12,
      "block": 11
    },
    {
      "text": "00",
      "box": [
        772,
        1477,
        816,
        1504
      ],
      "line": 12,
      "block": 11
    },
    {
      "text": "DM",
      "box": [
        826,
        1477,
        890,
        1504
      ],
      "line": 12,
      "block": 11
    },
    {
      "text": "4821",
      "box": [
        900,
        1477,
        988,
        1504
      ],
      "line": 12,
      "block": 11
    },
    {
      "text": "PIN",
      "box": [
        132,
        1622,
        206,
        1650
      ],
      "line": 13,
      "block": 12
    },
    {
      "text": "5302",
      "box": [
        216,
        1622,
        308,
        1650
      ],
      "line": 13,
      "block": 12
    },
    {
      "text": "Call",
      "box": [
        60,
        1744,
        118,
        1770
      ],
      "line": 14,
      "block": 13
    },
    {
      "text": "+91",
      "box": [
        127,
        1745,
        184,
        1770
      ],
      "line": 14,
      "block": 13
    },
    {
      "text": "98765",
      "box": [
        193,
        1745,
        288,
        1770
      ],
      "line": 14,
      "block": 13
    },
    {
      "text": "43210",
      "box": [
        297,
        1745,
        392,
        1770
      ],
      "line": 14,
      "block": 13
    },
    {
      "text": "Share",
      "box": [
        206,
        1867,
        309,
        1894
      ],
      "line": 15,
      "block": 14
    },
    {
      "text": "trip",
      "box": [
        318,
        1867,
        384,
        1903
      ],
      "line": 15,
      "block": 14
    },
    {
      "text": "Safety",
      "box": [
        728,
        1867,
        842,
        1903
      ],
      "line": 16,
      "block": 15
    }
  ]
}
