{"width":1080,"height":2400,"tokens":[{"text":"10:24","box":[50,35,129,58],"line":0,"block":0},{"text":"DEMO·","box":[364,99,467,135],"line":1,"block":1},{"text":"fictional","box":[472,99,601,135],"line":1,"block":1},{"text":"provider","box":[605,99,739,135],"line":1,"block":1},{"text":"Tamarind","box":[153,190,361,224],"line":2,"block":2},{"text":"Cabs","box":[377,190,478,224],"line":2,"block":2},{"text":"Cancel","box":[63,1043,216,1091],"line":3,"block":3},{"text":"your","box":[232,1043,342,1091],"line":3,"block":3},{"text":"ride?","box":[359,1043,470,1091],"line":3,"block":3},{"text":"Tell","box":[60,1114,113,1148],"line":4,"block":3},{"text":"us","box":[128,1114,161,1148],"line":4,"block":3},{"text":"why","box":[171,1114,236,1148],"line":4,"block":3},{"text":"you're","box":[245,1114,344,1148],"line":4,"block":3},{"text":"cancelling","box":[356,1114,511,1148],"line":4,"block":3},{"text":"Booked","box":[143,1224,272,1253],"line":5,"block":4},{"text":"another","box":[287,1224,425,1253],"line":5,"block":4},{"text":"ride","box":[439,1224,505,1253],"line":5,"block":4},{"text":"Driver","box":[144,1331,249,1361],"line":6,"block":5},{"text":"is","box":[263,1331,286,1361],"line":6,"block":5},{"text":"too","box":[299,1331,356,1361],"line":6,"block":5},{"text":"far","box":[369,1331,417,1361],"line":6,"block":5},{"text":"Changed","box":[142,1440,295,1478],"line":7,"block":6},{"text":"my","box":[311,1440,363,1478],"line":7,"block":6},{"text":"plans","box":[376,1440,467,1478],"line":7,"block":6},{"text":"Other","box":[142,1546,240,1577],"line":8,"block":7},{"text":"Free","box":[63,1674,128,1700],"line":9,"block":8},{"text":"to","box":[140,1674,170,1700],"line":9,"block":8},{"text":"cancel","box":[183,1674,278,1700],"line":9,"block":8},{"text":"while","box":[291,1674,373,1700],"line":9,"block":8},{"text":"we","box":[385,1674,428,1700],"line":9,"block":8},{"text":"search","box":[441,1674,541,1700],"line":9,"block":8},{"text":"Cancel","box":[416,1826,561,1862],"line":10,"block":9},{"text":"ride","box":[581,1826,666,1862],"line":10,"block":9},{"text":"Keep","box":[400,1996,502,2042],"line":11,"block":10},{"text":"my","box":[519,1996,583,2040],"line":11,"block":10},{"text":"ride","box":[598,1995,679,2039],"line":11,"block":10},{"text":"l","box":[888,34,895,62],"line":12,"block":11},{"text":"5G","box":[925,31,958,61],"line":12,"block":11},{"text":"I","box":[1018,30,1025,58],"line":12,"block":11}],"image_sha256":"3117f35244bfb2bafb4a131c3eebf045595762e5afa37d3c98af0980355d9b6b","engine":"mlkit-text-v2","recorded_at":"2026-10-29T01:37:32Z"}