{
  "image_sha256": "871c0c4f75853cc0f828d723016f52f8ef45e60e37b3afeb87ff22e08a3a7501",
  "width": 1080,
  "height": 2400,
  "engine": "synthetic",
  "recorded_at": "2026-10-28T00:00:00Z",
  "tokens": [
    {
      "text": "10:24",
      "box": [
        48,
        35,
        129,
        58
      ],
      "line": 1,
      "block": 1
    },
    {
      "text": "5G",
      "box": [
        926,
        39,
        962,
        60
      ],
      "line": 2,
      "block": 1
    },
    {
      "text": "DEMO",
      "box": [
        340,
        105,
        437,
        128
      ],
      "line": 3,
      "block": 2
    },
    {
      "text": "·",
      "box": [
        445,
        114,
        454,
        128
      ],
      "line": 3,
      "block": 2
    },
    {
      "text": "fictional",
      "box": [
        462,
        103,
        594,
        128
      ],
      "line": 3,
      "block": 2
    },
    {
      "text": "provider",
      "box": [
        602,
        103,
        739,
        136
      ],
      "line": 3,
      "block": 2
    },
    {
      "text": "P",
      "box": [
        78,
        192,
        106,
        224
      ],
      "line": 4,
      "block": 3
    },
    {
      "text": "Pepper",
      "box": [
        152,
        192,
        308,
        235
      ],
      "line": 5,
      "block": 4
    },
    {
      "text": "Rides",
      "box": [
        319,
        190,
        437,
        224
      ],
      "line": 5,
      "block": 4
    },
    {
      "text": "Booking",
      "box": [
        284,
        1008,
        516,
        1063
      ],
      "line": 6,
      "block": 5
    },
    {
      "text": "cancelled",
      "box": [
        531,
        1008,
        795,
        1051
      ],
      "line": 6,
      "block": 5
    },
    {
      "text": "No",
      "box": [
        265,
        1094,
        314,
        1120
      ],
      "line": 7,
      "block": 6
    },
    {
      "text": "cancellation",
      "box": [
        323,
        1093,
        523,
        1120
      ],
      "line": 7,
      "block": 6
    },
    {
      "text": "fee",
      "box": [
        532,
        1092,
        584,
        1120
      ],
      "line": 7,
      "block": 6
    },
    {
      "text": "was",
      "box": [
        593,
        1100,
        658,
        1120
      ],
      "line": 7,
      "block": 6
    },
    {
      "text": "charged.",
      "box": [
        667,
        1093,
        815,
        1129
      ],
      "line": 7,
      "block": 6
    },
    {
      "text": "Riverside",
      "box": [
        286,
        1155,
        422,
        1180
      ],
      "line": 8,
      "block": 7
    },
    {
      "text": "Gate",
      "box": [
        430,
        1156,
        501,
        1180
      ],
      "line": 8,
      "block": 7
    },
    {
      "text": "to",
      "box": [
        509,
        1158,
        540,
        1180
      ],
      "line": 8,
      "block": 7
    },
    {
      "text": "Airport",
      "box": [
        548,
        1155,
        653,
        1188
      ],
      "line": 8,
      "block": 7
    },
    {
      "text": "Terminal",
      "box": [
        661,
        1155,
        794,
        1180
      ],
      "line": 8,
      "block": 7
    },
    {
      "text": "Book",
      "box": [
        364,
        2248,
        476,
        2282
      ],
      "line": 9,
      "block": 8
    },
    {
      "text": "a",
      "box": [
        486,
        2257,
        513,
        2282
      ],
      "line": 9,
      "block": 8
    },
    {
      "text": "new",
      "box": [
        524,
        2257,
        617,
        2282
      ],
      "line": 9,
      "block": 8
    },
    {
      "text": "ride",
      "box": [
        628,
        2248,
        715,
        2282
      ],
      "line": 9,
      "block": 8
    }
  ]
}
