{"width":1080,"height":2400,"tokens":[{"text":"10:24","box":[50,35,129,58],"line":0,"block":0},{"text":"DEMO","box":[344,103,437,135],"line":1,"block":1},{"text":"fictional","box":[464,103,592,135],"line":1,"block":1},{"text":"provider","box":[606,103,739,135],"line":1,"block":1},{"text":"T","box":[67,182,133,233],"line":2,"block":2},{"text":"Tamarind","box":[153,182,360,233],"line":2,"block":2},{"text":"Cabs","box":[377,182,478,233],"line":2,"block":2},{"text":"Looking","box":[64,1331,249,1380],"line":3,"block":3},{"text":"for","box":[266,1330,334,1378],"line":3,"block":3},{"text":"a","box":[350,1330,372,1377],"line":3,"block":3},{"text":"driver...","box":[391,1328,570,1377],"line":3,"block":3},{"text":"Auto","box":[60,1400,134,1434],"line":4,"block":3},{"text":"Riverside","box":[166,1400,307,1434],"line":4,"block":3},{"text":"Gate","box":[319,1400,391,1434],"line":4,"block":3},{"text":"to","box":[401,1400,432,1434],"line":4,"block":3},{"text":"Airport","box":[462,1400,559,1434],"line":4,"block":3},{"text":"Terminal","box":[577,1400,705,1434],"line":4,"block":3},{"text":"Hang","box":[80,1551,153,1586],"line":5,"block":4},{"text":"tight,","box":[150,1551,228,1586],"line":5,"block":4},{"text":"this","box":[239,1551,293,1586],"line":5,"block":4},{"text":"usually","box":[304,1551,407,1586],"line":5,"block":4},{"text":"takes","box":[415,1551,494,1586],"line":5,"block":4},{"text":"a","box":[504,1551,518,1586],"line":5,"block":4},{"text":"minute","box":[532,1551,635,1586],"line":5,"block":4},{"text":"l","box":[888,34,895,62],"line":6,"block":5},{"text":"5G","box":[925,31,958,61],"line":6,"block":5},{"text":"I","box":[1018,30,1025,58],"line":6,"block":5}],"image_sha256":"7c8430d05cb4cd4151a262623bb18be75eb53b2f5b656a4d14d01ecbf1ec99b2","engine":"mlkit-text-v2","recorded_at":"2026-10-29T01:37:32Z"}