{
  "image_sha256": "69443ff9bdb8fb24d8bbc449592f57c059a257b609b658dd36d189d180e551c7",
  "width": 1080,
  "height": 2400,
  "engine": "synthetic",
  "recorded_at": "2026-10-28T00:00:00Z",
  "tokens": [
    {
      "text": "10:24",
      "box": [
        48,
        35,
        129,
        58
      ],
      "line": 1,
      "block": 1
    },
    {
      "text": "5G",
      "box": [
        926,
        39,
        962,
        60
      ],
      "line": 2,
      "block": 1
    },
    {
      "text": "DEMO",
      "box": [
        340,
        105,
        437,
        128
      ],
      "line": 3,
      "block": 2
    },
    {
      "text": "·",
      "box": [
        445,
        114,
        454,
        128
      ],
      "line": 3,
      "block": 2
    },
    {
      "text": "fictional",
      "box": [
        462,
        103,
        594,
        128
      ],
      "line": 3,
      "block": 2
    },
    {
      "text": "provider",
      "box": [
        602,
        103,
        739,
        136
      ],
      "line": 3,
      "block": 2
    },
    {
      "text": "P",
      "box": [
        78,
        192,
        106,
        224
      ],
      "line": 4,
      "block": 3
    },
    {
      "text": "Pepper",
      "box": [
        152,
        192,
        308,
        235
      ],
      "line": 5,
      "block": 4
    },
    {
      "text": "Rides",
      "box": [
        319,
        190,
        437,
        224
      ],
      "line": 5,
      "block": 4
    },
    {
      "text": "Pick",
      "box": [
        60,
        923,
        160,
        960
      ],
      "line": 6,
      "block": 5
    },
    {
      "text": "your",
      "box": [
        172,
        933,
        283,
        972
      ],
      "line": 6,
      "block": 5
    },
    {
      "text": "ride",
      "box": [
        295,
        923,
        390,
        960
      ],
      "line": 6,
      "block": 5
    },
    {
      "text": "Riverside",
      "box": [
        60,
        991,
        196,
        1016
      ],
      "line": 7,
      "block": 6
    },
    {
      "text": "Gate",
      "box": [
        204,
        992,
        275,
        1016
      ],
      "line": 7,
      "block": 6
    },
    {
      "text": "to",
      "box": [
        283,
        994,
        314,
        1016
      ],
      "line": 7,
      "block": 6
    },
    {
      "text": "Airport",
      "box": [
        322,
        991,
        427,
        1024
      ],
      "line": 7,
      "block": 6
    },
    {
      "text": "Terminal",
      "box": [
        435,
        991,
        568,
        1016
      ],
      "line": 7,
      "block": 6
    },
    {
      "text": "R१७२",
      "box": [
        893,
        1113,
        1008,
        1150
      ],
      "line": 8,
      "block": 7
    },
    {
      "text": "ऑटो",
      "box": [
        184,
        1103,
        262,
        1142
      ],
      "line": 9,
      "block": 7
    },
    {
      "text": "३",
      "box": [
        184,
        1178,
        199,
        1203
      ],
      "line": 10,
      "block": 7
    },
    {
      "text": "min",
      "box": [
        207,
        1173,
        265,
        1198
      ],
      "line": 10,
      "block": 7
    },
    {
      "text": "R264",
      "box": [
        888,
        1298,
        1008,
        1337
      ],
      "line": 11,
      "block": 8
    },
    {
      "text": "R299",
      "box": [
        932,
        1365,
        1008,
        1391
      ],
      "line": 12,
      "block": 8
    },
    {
      "text": "Pepper",
      "box": [
        184,
        1300,
        340,
        1343
      ],
      "line": 13,
      "block": 8
    },
    {
      "text": "Go",
      "box": [
        351,
        1299,
        410,
        1332
      ],
      "line": 13,
      "block": 8
    },
    {
      "text": "5",
      "box": [
        184,
        1364,
        202,
        1388
      ],
      "line": 14,
      "block": 8
    },
    {
      "text": "min",
      "box": [
        210,
        1363,
        268,
        1388
      ],
      "line": 14,
      "block": 8
    },
    {
      "text": "·",
      "box": [
        276,
        1374,
        285,
        1388
      ],
      "line": 14,
      "block": 8
    },
    {
      "text": "Everyday",
      "box": [
        293,
        1363,
        429,
        1396
      ],
      "line": 14,
      "block": 8
    },
    {
      "text": "cars",
      "box": [
        436,
        1370,
        497,
        1388
      ],
      "line": 14,
      "block": 8
    },
    {
      "text": "R398",
      "box": [
        888,
        1488,
        1008,
        1527
      ],
      "line": 15,
      "block": 9
    },
    {
      "text": "Pepper",
      "box": [
        184,
        1490,
        340,
        1533
      ],
      "line": 16,
      "block": 9
    },
    {
      "text": "Prime",
      "box": [
        351,
        1488,
        481,
        1522
      ],
      "line": 16,
      "block": 9
    },
    {
      "text": "Sedan",
      "box": [
        492,
        1488,
        626,
        1522
      ],
      "line": 16,
      "block": 9
    },
    {
      "text": "7",
      "box": [
        184,
        1554,
        202,
        1578
      ],
      "line": 17,
      "block": 9
    },
    {
      "text": "min",
      "box": [
        210,
        1553,
        268,
        1578
      ],
      "line": 17,
      "block": 9
    },
    {
      "text": "·",
      "box": [
        276,
        1564,
        285,
        1578
      ],
      "line": 17,
      "block": 9
    },
    {
      "text": "Top-rated",
      "box": [
        293,
        1553,
        441,
        1586
      ],
      "line": 17,
      "block": 9
    },
    {
      "text": "drivers",
      "box": [
        449,
        1553,
        552,
        1578
      ],
      "line": 17,
      "block": 9
    },
    {
      "text": "Pay",
      "box": [
        60,
        2172,
        114,
        2204
      ],
      "line": 18,
      "block": 10
    },
    {
      "text": "by",
      "box": [
        121,
        2171,
        158,
        2204
      ],
      "line": 18,
      "block": 10
    },
    {
      "text": "cash",
      "box": [
        165,
        2171,
        233,
        2196
      ],
      "line": 18,
      "block": 10
    },
    {
      "text": "or",
      "box": [
        241,
        2178,
        273,
        2196
      ],
      "line": 18,
      "block": 10
    },
    {
      "text": "UPI",
      "box": [
        281,
        2172,
        334,
        2196
      ],
      "line": 18,
      "block": 10
    },
    {
      "text": "Book",
      "box": [
        432,
        2272,
        544,
        2306
      ],
      "line": 19,
      "block": 11
    },
    {
      "text": "now",
      "box": [
        554,
        2281,
        648,
        2306
      ],
      "line": 19,
      "block": 11
    }
  ],
  "variant": "rupee_as_R",
  "expect": {
    "rows": [
      "VERIFIED",
      "VERIFIED",
      "VERIFIED"
    ],
    "reason": "₹ read as 'R'; the parser normalises it (M5)"
  }
}
