{"width":1080,"height":2400,"tokens":[{"text":"10:24","box":[50,35,129,58],"line":0,"block":0},{"text":"DEMO·","box":[364,99,467,135],"line":1,"block":1},{"text":"fictional","box":[472,99,601,135],"line":1,"block":1},{"text":"provider","box":[605,99,739,135],"line":1,"block":1},{"text":"T","box":[69,182,133,234],"line":2,"block":2},{"text":"Tamarind","box":[153,182,360,234],"line":2,"block":2},{"text":"Cabs","box":[377,182,478,234],"line":2,"block":2},{"text":"Ride","box":[345,1008,460,1051],"line":3,"block":3},{"text":"cancelled","box":[479,1008,737,1051],"line":3,"block":3},{"text":"No","box":[282,1088,325,1125],"line":4,"block":4},{"text":"cancellation","box":[325,1088,520,1125],"line":4,"block":4},{"text":"fee","box":[532,1088,583,1125],"line":4,"block":4},{"text":"was","box":[593,1088,657,1125],"line":4,"block":4},{"text":"charged.","box":[669,1088,811,1125],"line":4,"block":4},{"text":"Riverside","box":[289,1155,420,1186],"line":5,"block":4},{"text":"Gate","box":[432,1155,499,1186],"line":5,"block":4},{"text":"to","box":[509,1155,539,1186],"line":5,"block":4},{"text":"Airport","box":[548,1155,652,1186],"line":5,"block":4},{"text":"Terminal","box":[661,1155,792,1186],"line":5,"block":4},{"text":"Book","box":[369,2248,476,2282],"line":6,"block":5},{"text":"a","box":[489,2248,510,2282],"line":6,"block":5},{"text":"new","box":[529,2248,617,2282],"line":6,"block":5},{"text":"ride","box":[633,2248,714,2282],"line":6,"block":5},{"text":"l","box":[888,34,895,62],"line":7,"block":6},{"text":"5G","box":[925,31,958,61],"line":7,"block":6},{"text":"I","box":[1018,30,1025,58],"line":7,"block":6}],"image_sha256":"831792e72f9c166c82283d927a3ad9ac7f3e7c7020b511c4dd974d0b90f78ef5","engine":"mlkit-text-v2","recorded_at":"2026-10-29T01:37:32Z"}