{
  "image_sha256": "467d6211aa2f882c95aa994d01e19831187700ea5e2d0ffda3ba882c82f7c33b",
  "width": 1080,
  "height": 2400,
  "engine": "synthetic",
  "recorded_at": "2026-10-28T00:00:00Z",
  "tokens": [
    {
      "text": "10:24",
      "box": [
        48,
        35,
        129,
        58
      ],
      "line": 1,
      "block": 1
    },
    {
      "text": "5G",
      "box": [
        926,
        39,
        962,
        60
      ],
      "line": 2,
      "block": 1
    },
    {
      "text": "DEMO",
      "box": [
        340,
        105,
        437,
        128
      ],
      "line": 3,
      "block": 2
    },
    {
      "text": "·",
      "box": [
        445,
        114,
        454,
        128
      ],
      "line": 3,
      "block": 2
    },
    {
      "text": "fictional",
      "box": [
        462,
        103,
        594,
        128
      ],
      "line": 3,
      "block": 2
    },
    {
      "text": "provider",
      "box": [
        602,
        103,
        739,
        136
      ],
      "line": 3,
      "block": 2
    },
    {
      "text": "P",
      "box": [
        78,
        192,
        106,
        224
      ],
      "line": 4,
      "block": 3
    },
    {
      "text": "Pepper",
      "box": [
        152,
        192,
        308,
        235
      ],
      "line": 5,
      "block": 4
    },
    {
      "text": "Rides",
      "box": [
        319,
        190,
        437,
        224
      ],
      "line": 5,
      "block": 4
    },
    {
      "text": "Cancel",
      "box": [
        60,
        1043,
        220,
        1080
      ],
      "line": 6,
      "block": 5
    },
    {
      "text": "your",
      "box": [
        232,
        1053,
        343,
        1092
      ],
      "line": 6,
      "block": 5
    },
    {
      "text": "ride?",
      "box": [
        355,
        1043,
        473,
        1080
      ],
      "line": 6,
      "block": 5
    },
    {
      "text": "Tell",
      "box": [
        60,
        1114,
        116,
        1140
      ],
      "line": 7,
      "block": 6
    },
    {
      "text": "us",
      "box": [
        125,
        1121,
        162,
        1140
      ],
      "line": 7,
      "block": 6
    },
    {
      "text": "why",
      "box": [
        171,
        1114,
        237,
        1148
      ],
      "line": 7,
      "block": 6
    },
    {
      "text": "you're",
      "box": [
        245,
        1115,
        345,
        1148
      ],
      "line": 7,
      "block": 6
    },
    {
      "text": "cancelling",
      "box": [
        354,
        1114,
        514,
        1148
      ],
      "line": 7,
      "block": 6
    },
    {
      "text": "Booked",
      "box": [
        140,
        1224,
        275,
        1253
      ],
      "line": 8,
      "block": 7
    },
    {
      "text": "another",
      "box": [
        285,
        1224,
        426,
        1253
      ],
      "line": 8,
      "block": 7
    },
    {
      "text": "ride",
      "box": [
        436,
        1224,
        506,
        1253
      ],
      "line": 8,
      "block": 7
    },
    {
      "text": "Driver",
      "box": [
        140,
        1332,
        250,
        1361
      ],
      "line": 9,
      "block": 8
    },
    {
      "text": "is",
      "box": [
        260,
        1332,
        288,
        1361
      ],
      "line": 9,
      "block": 8
    },
    {
      "text": "too",
      "box": [
        298,
        1335,
        358,
        1361
      ],
      "line": 9,
      "block": 8
    },
    {
      "text": "far",
      "box": [
        368,
        1331,
        418,
        1361
      ],
      "line": 9,
      "block": 8
    },
    {
      "text": "Changed",
      "box": [
        140,
        1440,
        298,
        1478
      ],
      "line": 10,
      "block": 9
    },
    {
      "text": "my",
      "box": [
        308,
        1448,
        364,
        1478
      ],
      "line": 10,
      "block": 9
    },
    {
      "text": "plans",
      "box": [
        373,
        1440,
        468,
        1478
      ],
      "line": 10,
      "block": 9
    },
    {
      "text": "Other",
      "box": [
        140,
        1548,
        244,
        1577
      ],
      "line": 11,
      "block": 10
    },
    {
      "text": "Cancellation",
      "box": [
        60,
        1674,
        256,
        1700
      ],
      "line": 12,
      "block": 11
    },
    {
      "text": "fee",
      "box": [
        265,
        1673,
        315,
        1700
      ],
      "line": 12,
      "block": 11
    },
    {
      "text": "up",
      "box": [
        324,
        1681,
        366,
        1708
      ],
      "line": 12,
      "block": 11
    },
    {
      "text": "to",
      "box": [
        375,
        1676,
        408,
        1700
      ],
      "line": 12,
      "block": 11
    },
    {
      "text": "₹50",
      "box": [
        417,
        1675,
        474,
        1701
      ],
      "line": 12,
      "block": 11
    },
    {
      "text": "may",
      "box": [
        483,
        1681,
        552,
        1708
      ],
      "line": 12,
      "block": 11
    },
    {
      "text": "apply",
      "box": [
        560,
        1674,
        648,
        1708
      ],
      "line": 12,
      "block": 11
    },
    {
      "text": "Cancel",
      "box": [
        412,
        1826,
        564,
        1862
      ],
      "line": 13,
      "block": 12
    },
    {
      "text": "ride",
      "box": [
        576,
        1826,
        667,
        1862
      ],
      "line": 13,
      "block": 12
    },
    {
      "text": "Keep",
      "box": [
        397,
        1999,
        506,
        2042
      ],
      "line": 14,
      "block": 13
    },
    {
      "text": "my",
      "box": [
        517,
        2006,
        586,
        2042
      ],
      "line": 14,
      "block": 13
    },
    {
      "text": "ride",
      "box": [
        596,
        1997,
        683,
        2031
      ],
      "line": 14,
      "block": 13
    }
  ]
}
