{"width":1080,"height":2400,"tokens":[{"text":"10:24","box":[50,35,129,58],"line":0,"block":0},{"text":"Pepper","box":[155,187,306,235],"line":1,"block":1},{"text":"Rides","box":[321,185,432,231],"line":1,"block":1},{"text":"Driver","box":[62,1175,208,1229],"line":2,"block":2},{"text":"assigned","box":[223,1179,430,1233],"line":2,"block":2},{"text":"DEMO","box":[344,103,437,134],"line":3,"block":3},{"text":"fictional","box":[464,103,592,134],"line":3,"block":3},{"text":"provider","box":[605,103,739,134],"line":3,"block":3},{"text":"3","box":[93,1259,111,1314],"line":4,"block":4},{"text":"min","box":[153,1261,243,1321],"line":4,"block":4},{"text":"away","box":[242,1265,393,1328],"line":4,"block":4},{"text":"I","box":[109,1473,124,1508],"line":5,"block":5},{"text":"0.5","box":[61,1338,109,1375],"line":6,"block":6},{"text":"km","box":[123,1340,171,1376],"line":6,"block":6},{"text":"from","box":[183,1341,263,1378],"line":6,"block":6},{"text":"pickup","box":[277,1343,384,1381],"line":6,"block":6},{"text":"Imran","box":[197,1446,329,1478],"line":7,"block":7},{"text":"Auto","box":[213,1501,276,1531],"line":8,"block":8},{"text":"Demo","box":[295,1501,381,1531],"line":8,"block":8},{"text":"Motors","box":[393,1501,496,1531],"line":8,"block":8},{"text":"PIN","box":[136,1622,202,1650],"line":9,"block":9},{"text":"5302","box":[218,1622,306,1650],"line":9,"block":9},{"text":"Call","box":[62,1744,115,1770],"line":10,"block":10},{"text":"+91","box":[129,1744,177,1770],"line":10,"block":10},{"text":"98765","box":[195,1744,287,1770],"line":10,"block":10},{"text":"43210","box":[298,1744,391,1770],"line":10,"block":10},{"text":"Share","box":[207,1863,307,1901],"line":11,"block":11},{"text":"trip","box":[318,1866,380,1902],"line":11,"block":11},{"text":"l","box":[888,34,895,62],"line":12,"block":12},{"text":"5G","box":[925,31,958,61],"line":12,"block":12},{"text":"I","box":[1018,30,1025,58],"line":12,"block":12},{"text":"XX","box":[712,1472,762,1507],"line":13,"block":13},{"text":"00","box":[786,1472,827,1507],"line":13,"block":13},{"text":"DM","box":[829,1472,886,1507],"line":13,"block":13},{"text":"7305","box":[901,1472,986,1507],"line":13,"block":13},{"text":"Safety","box":[729,1864,841,1902],"line":14,"block":14}],"image_sha256":"23efe5ca9ebd8a10a6d4bebe4afcdcfdad183eb6ce097879f3e6c1c96a09ce4e","engine":"mlkit-text-v2","recorded_at":"2026-10-29T01:37:32Z"}