{
  "image_sha256": "63d3306c5057dc99706c96dde86c7e939f05a4deb1564f98c1381c9c284c854a",
  "width": 1080,
  "height": 2400,
  "engine": "synthetic",
  "recorded_at": "2026-10-28T00:00:00Z",
  "tokens": [
    {
      "text": "10:24",
      "box": [
        48,
        35,
        129,
        58
      ],
      "line": 1,
      "block": 1
    },
    {
      "text": "5G",
      "box": [
        926,
        39,
        962,
        60
      ],
      "line": 2,
      "block": 1
    },
    {
      "text": "DEMO",
      "box": [
        340,
        105,
        437,
        128
      ],
      "line": 3,
      "block": 2
    },
    {
      "text": "·",
      "box": [
        445,
        114,
        454,
        128
      ],
      "line": 3,
      "block": 2
    },
    {
      "text": "fictional",
      "box": [
        462,
        103,
        594,
        128
      ],
      "line": 3,
      "block": 2
    },
    {
      "text": "provider",
      "box": [
        602,
        103,
        739,
        136
      ],
      "line": 3,
      "block": 2
    },
    {
      "text": "T",
      "box": [
        79,
        192,
        104,
        224
      ],
      "line": 4,
      "block": 3
    },
    {
      "text": "Tamarind",
      "box": [
        152,
        190,
        364,
        224
      ],
      "line": 5,
      "block": 4
    },
    {
      "text": "Cabs",
      "box": [
        375,
        190,
        480,
        224
      ],
      "line": 5,
      "block": 4
    },
    {
      "text": "Choose",
      "box": [
        60,
        923,
        235,
        960
      ],
      "line": 6,
      "block": 5
    },
    {
      "text": "a",
      "box": [
        247,
        933,
        276,
        960
      ],
      "line": 6,
      "block": 5
    },
    {
      "text": "cab",
      "box": [
        288,
        923,
        372,
        960
      ],
      "line": 6,
      "block": 5
    },
    {
      "text": "Riverside",
      "box": [
        60,
        991,
        196,
        1016
      ],
      "line": 7,
      "block": 6
    },
    {
      "text": "Gate",
      "box": [
        204,
        992,
        275,
        1016
      ],
      "line": 7,
      "block": 6
    },
    {
      "text": "to",
      "box": [
        283,
        994,
        314,
        1016
      ],
      "line": 7,
      "block": 6
    },
    {
      "text": "Airport",
      "box": [
        322,
        991,
        427,
        1024
      ],
      "line": 7,
      "block": 6
    },
    {
      "text": "Terminal",
      "box": [
        435,
        991,
        568,
        1016
      ],
      "line": 7,
      "block": 6
    },
    {
      "text": "%104",
      "box": [
        888,
        1108,
        1008,
        1147
      ],
      "line": 8,
      "block": 7
    },
    {
      "text": "Moto",
      "box": [
        184,
        1110,
        298,
        1142
      ],
      "line": 9,
      "block": 7
    },
    {
      "text": "3",
      "box": [
        184,
        1174,
        202,
        1198
      ],
      "line": 10,
      "block": 7
    },
    {
      "text": "min",
      "box": [
        210,
        1173,
        268,
        1198
      ],
      "line": 10,
      "block": 7
    },
    {
      "text": "·",
      "box": [
        276,
        1184,
        285,
        1198
      ],
      "line": 10,
      "block": 7
    },
    {
      "text": "Solo",
      "box": [
        293,
        1173,
        357,
        1198
      ],
      "line": 10,
      "block": 7
    },
    {
      "text": "rides",
      "box": [
        365,
        1173,
        439,
        1198
      ],
      "line": 10,
      "block": 7
    },
    {
      "text": "%176",
      "box": [
        888,
        1298,
        1008,
        1337
      ],
      "line": 11,
      "block": 8
    },
    {
      "text": "%205",
      "box": [
        932,
        1365,
        1008,
        1391
      ],
      "line": 12,
      "block": 8
    },
    {
      "text": "Auto",
      "box": [
        184,
        1300,
        289,
        1332
      ],
      "line": 13,
      "block": 8
    },
    {
      "text": "5",
      "box": [
        184,
        1364,
        202,
        1388
      ],
      "line": 14,
      "block": 8
    },
    {
      "text": "min",
      "box": [
        210,
        1363,
        268,
        1388
      ],
      "line": 14,
      "block": 8
    },
    {
      "text": "·",
      "box": [
        276,
        1374,
        285,
        1388
      ],
      "line": 14,
      "block": 8
    },
    {
      "text": "Pay",
      "box": [
        293,
        1364,
        347,
        1396
      ],
      "line": 14,
      "block": 8
    },
    {
      "text": "after",
      "box": [
        354,
        1362,
        426,
        1388
      ],
      "line": 14,
      "block": 8
    },
    {
      "text": "the",
      "box": [
        434,
        1363,
        484,
        1388
      ],
      "line": 14,
      "block": 8
    },
    {
      "text": "ride",
      "box": [
        492,
        1363,
        551,
        1388
      ],
      "line": 14,
      "block": 8
    },
    {
      "text": "%272",
      "box": [
        888,
        1488,
        1008,
        1526
      ],
      "line": 15,
      "block": 9
    },
    {
      "text": "Tamarind",
      "box": [
        184,
        1488,
        396,
        1522
      ],
      "line": 16,
      "block": 9
    },
    {
      "text": "Cab",
      "box": [
        407,
        1488,
        490,
        1522
      ],
      "line": 16,
      "block": 9
    },
    {
      "text": "4",
      "box": [
        184,
        1554,
        202,
        1578
      ],
      "line": 17,
      "block": 9
    },
    {
      "text": "min",
      "box": [
        210,
        1553,
        268,
        1578
      ],
      "line": 17,
      "block": 9
    },
    {
      "text": "·",
      "box": [
        276,
        1564,
        285,
        1578
      ],
      "line": 17,
      "block": 9
    },
    {
      "text": "AC",
      "box": [
        293,
        1554,
        333,
        1578
      ],
      "line": 17,
      "block": 9
    },
    {
      "text": "hatchbacks",
      "box": [
        341,
        1553,
        511,
        1578
      ],
      "line": 17,
      "block": 9
    },
    {
      "text": "%1,040",
      "box": [
        843,
        1678,
        1008,
        1723
      ],
      "line": 18,
      "block": 10
    },
    {
      "text": "Tamarind",
      "box": [
        184,
        1678,
        396,
        1712
      ],
      "line": 19,
      "block": 10
    },
    {
      "text": "XL",
      "box": [
        407,
        1680,
        461,
        1712
      ],
      "line": 19,
      "block": 10
    },
    {
      "text": "8",
      "box": [
        184,
        1744,
        202,
        1768
      ],
      "line": 20,
      "block": 10
    },
    {
      "text": "min",
      "box": [
        210,
        1743,
        268,
        1768
      ],
      "line": 20,
      "block": 10
    },
    {
      "text": "·",
      "box": [
        276,
        1754,
        285,
        1768
      ],
      "line": 20,
      "block": 10
    },
    {
      "text": "Room",
      "box": [
        293,
        1744,
        381,
        1768
      ],
      "line": 20,
      "block": 10
    },
    {
      "text": "for",
      "box": [
        389,
        1742,
        432,
        1768
      ],
      "line": 20,
      "block": 10
    },
    {
      "text": "six",
      "box": [
        440,
        1743,
        480,
        1768
      ],
      "line": 20,
      "block": 10
    },
    {
      "text": "Pay",
      "box": [
        60,
        2172,
        114,
        2204
      ],
      "line": 21,
      "block": 11
    },
    {
      "text": "by",
      "box": [
        121,
        2171,
        158,
        2204
      ],
      "line": 21,
      "block": 11
    },
    {
      "text": "cash",
      "box": [
        165,
        2171,
        233,
        2196
      ],
      "line": 21,
      "block": 11
    },
    {
      "text": "or",
      "box": [
        241,
        2178,
        273,
        2196
      ],
      "line": 21,
      "block": 11
    },
    {
      "text": "UPI",
      "box": [
        281,
        2172,
        334,
        2196
      ],
      "line": 21,
      "block": 11
    },
    {
      "text": "Book",
      "box": [
        432,
        2272,
        544,
        2306
      ],
      "line": 22,
      "block": 12
    },
    {
      "text": "now",
      "box": [
        554,
        2281,
        648,
        2306
      ],
      "line": 22,
      "block": 12
    }
  ],
  "variant": "rupee_as_pct",
  "expect": {
    "rows": [
      "VERIFIED",
      "VERIFIED",
      "VERIFIED",
      "VERIFIED"
    ],
    "reason": "₹ read as '%'; the parser normalises it (M5)"
  }
}
