{
  "image_sha256": "b8986903b724187070bf8f2c6e1845a7e185a50023fb16082ec850bd16027ef4",
  "width": 1080,
  "height": 2400,
  "engine": "synthetic",
  "recorded_at": "2026-10-28T00:00:00Z",
  "tokens": [
    {
      "text": "10:24",
      "box": [
        48,
        35,
        129,
        58
      ],
      "line": 1,
      "block": 1
    },
    {
      "text": "5G",
      "box": [
        926,
        39,
        962,
        60
      ],
      "line": 2,
      "block": 1
    },
    {
      "text": "DEMO",
      "box": [
        340,
        105,
        437,
        128
      ],
      "line": 3,
      "block": 2
    },
    {
      "text": "·",
      "box": [
        445,
        114,
        454,
        128
      ],
      "line": 3,
      "block": 2
    },
    {
      "text": "fictional",
      "box": [
        462,
        103,
        594,
        128
      ],
      "line": 3,
      "block": 2
    },
    {
      "text": "provider",
      "box": [
        602,
        103,
        739,
        136
      ],
      "line": 3,
      "block": 2
    },
    {
      "text": "P",
      "box": [
        78,
        192,
        106,
        224
      ],
      "line": 4,
      "block": 3
    },
    {
      "text": "Pepper",
      "box": [
        152,
        192,
        308,
        235
      ],
      "line": 5,
      "block": 4
    },
    {
      "text": "Rides",
      "box": [
        319,
        190,
        437,
        224
      ],
      "line": 5,
      "block": 4
    },
    {
      "text": "Searching",
      "box": [
        60,
        1333,
        299,
        1382
      ],
      "line": 6,
      "block": 5
    },
    {
      "text": "for",
      "box": [
        311,
        1333,
        382,
        1370
      ],
      "line": 6,
      "block": 5
    },
    {
      "text": "nearby",
      "box": [
        394,
        1333,
        563,
        1382
      ],
      "line": 6,
      "block": 5
    },
    {
      "text": "drivers…",
      "box": [
        574,
        1333,
        783,
        1370
      ],
      "line": 6,
      "block": 5
    },
    {
      "text": "ऑटो",
      "box": [
        60,
        1399,
        117,
        1430
      ],
      "line": 7,
      "block": 6
    },
    {
      "text": "·",
      "box": [
        125,
        1415,
        134,
        1430
      ],
      "line": 7,
      "block": 6
    },
    {
      "text": "Riverside",
      "box": [
        143,
        1404,
        288,
        1430
      ],
      "line": 7,
      "block": 6
    },
    {
      "text": "Gate",
      "box": [
        297,
        1405,
        372,
        1430
      ],
      "line": 7,
      "block": 6
    },
    {
      "text": "to",
      "box": [
        381,
        1406,
        414,
        1430
      ],
      "line": 7,
      "block": 6
    },
    {
      "text": "Airport",
      "box": [
        423,
        1404,
        536,
        1438
      ],
      "line": 7,
      "block": 6
    },
    {
      "text": "Terminal",
      "box": [
        545,
        1404,
        687,
        1430
      ],
      "line": 7,
      "block": 6
    },
    {
      "text": "Hang",
      "box": [
        60,
        1556,
        142,
        1588
      ],
      "line": 8,
      "block": 7
    },
    {
      "text": "tight,",
      "box": [
        150,
        1555,
        231,
        1588
      ],
      "line": 8,
      "block": 7
    },
    {
      "text": "this",
      "box": [
        239,
        1555,
        294,
        1580
      ],
      "line": 8,
      "block": 7
    },
    {
      "text": "usually",
      "box": [
        302,
        1555,
        408,
        1588
      ],
      "line": 8,
      "block": 7
    },
    {
      "text": "takes",
      "box": [
        415,
        1555,
        495,
        1580
      ],
      "line": 8,
      "block": 7
    },
    {
      "text": "a",
      "box": [
        503,
        1562,
        521,
        1580
      ],
      "line": 8,
      "block": 7
    },
    {
      "text": "minute",
      "box": [
        529,
        1555,
        637,
        1580
      ],
      "line": 8,
      "block": 7
    }
  ]
}
