{"width":1080,"height":2400,"tokens":[{"text":"10:24","box":[50,35,128,58],"line":0,"block":0},{"text":"DEMO","box":[344,103,436,134],"line":1,"block":1},{"text":"fictional","box":[448,103,592,134],"line":1,"block":1},{"text":"provider","box":[606,103,739,134],"line":1,"block":1},{"text":"K","box":[75,186,133,230],"line":2,"block":2},{"text":"Kestrel","box":[156,186,304,230],"line":2,"block":2},{"text":"Go","box":[320,186,375,230],"line":2,"block":2},{"text":"X","box":[449,668,630,845],"line":3,"block":3},{"text":"Trip","box":[347,1006,451,1064],"line":4,"block":4},{"text":"cancelled","box":[471,1001,728,1062],"line":4,"block":4},{"text":"No","box":[268,1092,312,1127],"line":5,"block":5},{"text":"cancellation","box":[325,1092,520,1127],"line":5,"block":5},{"text":"fee","box":[532,1092,583,1127],"line":5,"block":5},{"text":"was","box":[593,1092,657,1127],"line":5,"block":5},{"text":"charged.","box":[669,1092,811,1127],"line":5,"block":5},{"text":"Riverside","box":[289,1155,421,1185],"line":6,"block":5},{"text":"Gate","box":[432,1155,500,1185],"line":6,"block":5},{"text":"to","box":[509,1155,539,1185],"line":6,"block":5},{"text":"Airport","box":[548,1155,652,1185],"line":6,"block":5},{"text":"Terminal","box":[661,1155,792,1185],"line":6,"block":5},{"text":"Book","box":[369,2248,476,2282],"line":7,"block":6},{"text":"a","box":[489,2248,510,2282],"line":7,"block":6},{"text":"new","box":[529,2248,617,2282],"line":7,"block":6},{"text":"ride","box":[633,2248,714,2282],"line":7,"block":6},{"text":"l","box":[888,34,895,62],"line":8,"block":7},{"text":"5G","box":[925,31,958,61],"line":8,"block":7},{"text":"I","box":[1018,30,1025,58],"line":8,"block":7}],"image_sha256":"d4b13df48fdf47360c3e208e6681e0e62c4900d04cfa7c7310e93d0116ebdef4","engine":"mlkit-text-v2","recorded_at":"2026-10-29T01:37:32Z"}