{"width":1080,"height":2400,"tokens":[{"text":"10:24","box":[50,35,128,58],"line":0,"block":0},{"text":"K","box":[75,186,133,230],"line":1,"block":1},{"text":"Kestrel","box":[156,186,304,230],"line":1,"block":1},{"text":"Go","box":[320,186,375,230],"line":1,"block":1},{"text":"Rider","box":[63,1179,185,1224],"line":2,"block":2},{"text":"on","box":[200,1181,256,1225],"line":2,"block":2},{"text":"the","box":[273,1182,351,1225],"line":2,"block":2},{"text":"way","box":[366,1183,462,1227],"line":2,"block":2},{"text":"DEMO","box":[344,103,437,134],"line":3,"block":3},{"text":"fictional","box":[464,103,592,134],"line":3,"block":3},{"text":"provider","box":[605,103,739,134],"line":3,"block":3},{"text":"4","box":[95,1260,113,1314],"line":4,"block":4},{"text":"min","box":[111,1260,222,1319],"line":4,"block":4},{"text":"away","box":[242,1266,394,1326],"line":4,"block":4},{"text":"1.6","box":[63,1338,110,1376],"line":5,"block":5},{"text":"km","box":[123,1340,171,1377],"line":5,"block":5},{"text":"from","box":[183,1341,263,1379],"line":5,"block":5},{"text":"pickup","box":[277,1343,384,1382],"line":5,"block":5},{"text":"A","box":[100,1473,131,1508],"line":6,"block":6},{"text":"Arjun","box":[196,1444,312,1489],"line":7,"block":7},{"text":"Auto","box":[210,1501,275,1531],"line":8,"block":8},{"text":"Demo","box":[295,1501,381,1531],"line":8,"block":8},{"text":"Motors","box":[393,1501,496,1531],"line":8,"block":8},{"text":"OTP","box":[131,1622,207,1650],"line":9,"block":9},{"text":"4719","box":[220,1622,309,1650],"line":9,"block":9},{"text":"Call","box":[62,1744,115,1770],"line":10,"block":10},{"text":"+91","box":[129,1744,177,1770],"line":10,"block":10},{"text":"98765","box":[195,1744,287,1770],"line":10,"block":10},{"text":"43210","box":[298,1744,391,1770],"line":10,"block":10},{"text":"Share","box":[207,1862,308,1900],"line":11,"block":11},{"text":"trip","box":[318,1865,380,1902],"line":11,"block":11},{"text":"l","box":[888,34,895,62],"line":12,"block":12},{"text":"5G","box":[925,31,958,61],"line":12,"block":12},{"text":"I","box":[1018,30,1025,58],"line":12,"block":12},{"text":"XX","box":[712,1477,762,1504],"line":13,"block":13},{"text":"00","box":[773,1477,814,1504],"line":13,"block":13},{"text":"DM","box":[829,1477,886,1504],"line":13,"block":13},{"text":"1001","box":[903,1477,982,1504],"line":13,"block":13},{"text":"Safety","box":[729,1864,841,1902],"line":14,"block":14}],"image_sha256":"0a40b32865dc7992183409979a8372bf57955e56ea2d8c4885e3e0f017419bfc","engine":"mlkit-text-v2","recorded_at":"2026-10-29T01:37:32Z"}