{"width":1080,"height":2400,"tokens":[{"text":"10:24","box":[50,35,128,58],"line":0,"block":0},{"text":"DEMO","box":[344,103,436,135],"line":1,"block":1},{"text":"·","box":[448,103,453,135],"line":1,"block":1},{"text":"fictional","box":[464,103,592,135],"line":1,"block":1},{"text":"provider","box":[606,103,739,135],"line":1,"block":1},{"text":"K","box":[75,185,133,230],"line":2,"block":2},{"text":"Kestrel","box":[156,185,304,230],"line":2,"block":2},{"text":"Go","box":[320,185,375,230],"line":2,"block":2},{"text":"Findinga","box":[73,1328,301,1382],"line":3,"block":3},{"text":"rider...","box":[295,1325,447,1378],"line":3,"block":3},{"text":"Auto","box":[60,1401,134,1435],"line":4,"block":4},{"text":"Riverside","box":[166,1401,307,1435],"line":4,"block":4},{"text":"Gate","box":[319,1401,391,1435],"line":4,"block":4},{"text":"to","box":[401,1401,432,1435],"line":4,"block":4},{"text":"Airport","box":[462,1401,559,1435],"line":4,"block":4},{"text":"Terminal","box":[577,1401,706,1435],"line":4,"block":4},{"text":"Hang","box":[63,1555,139,1586],"line":5,"block":5},{"text":"tight,","box":[150,1555,228,1586],"line":5,"block":5},{"text":"this","box":[239,1555,293,1586],"line":5,"block":5},{"text":"usually","box":[304,1555,407,1586],"line":5,"block":5},{"text":"takes","box":[415,1555,494,1586],"line":5,"block":5},{"text":"a","box":[504,1555,518,1586],"line":5,"block":5},{"text":"minute","box":[532,1555,635,1586],"line":5,"block":5},{"text":"l","box":[888,34,895,62],"line":6,"block":6},{"text":"5G","box":[925,31,958,61],"line":6,"block":6},{"text":"I","box":[1018,30,1025,58],"line":6,"block":6}],"image_sha256":"aebe95d8df30f936666733b4ae737b44ee4931e91aeacda641eae2f90faa8594","engine":"mlkit-text-v2","recorded_at":"2026-10-29T01:37:32Z"}